{
  "schema_version": "0.1.1",
  "report_id": "RPT-2026-0918-001",
  "record_ref": "REC-2026-0918-001",
  "provenance": {
    "input_origin": "simulated",
    "report_status": "expected"
  },
  "device": {
    "model": "MPC5554"
  },
  "test": {
    "id": "PBIT-DSPI-C-0007",
    "target": "DSPI_C",
    "name": "DSPI_C 回环自检",
    "result": "fail"
  },
  "observations": [],
  "analysis": {
    "fault_state": "not_determined",
    "root_cause": "not_determined",
    "confirmed_states": [],
    "candidate_causes": [],
    "inconsistencies": [],
    "insufficient_data": [
      {
        "missing": "DSPI_C 的寄存器观测（DSPIx_SR 的状态与标志位、DSPIx_MCR 的 MSTR）",
        "reason": "检测 PBIT-DSPI-C-0007 报失败，但记录中没有 DSPI_C 的任何寄存器观测。第 20 章不含错误处理或故障封闭章节：DSPIx_SR 的状态位能确认若干具体条件（FIFO 溢出/下溢、TX/RX 运行状态、传输完成），但该章没有把这些条件归入故障分类的规则；仅凭检测结论无法把这次失败归入某个故障状态，也无法在「传输未启动」「传输完成但数据不符」「接收缓冲异常」之间区分，因此本次不给出 DSPI_C 的故障状态与根因结论。缺少观测表示未知，不等于该外设正常。"
      }
    ],
    "recommended_checks": [
      "补充采集 DSPI_C.SR，并同时记录 DSPI_C.MCR 的 MDIS 与 MSTR 位；MSTR 决定 TFUF 是否可能置位",
      "记录自检发送的 MOSI 值与实际接收的 MISO 值，以及该次传输是否在限时内完成",
      "提供该次自检的测试定义，包括期望接收值、限时与判定条件，以便复核 test.result",
      "若 DSPI_C 工作于从模式，一并记录 TFUF 位与外部主机的传输时刻"
    ],
    "unsupported": []
  }
}
