{
  "schema_version": "0.1.1",
  "report_id": "RPT-2026-0918-002",
  "record_ref": "REC-2026-0918-002",
  "provenance": {
    "input_origin": "simulated",
    "report_status": "expected"
  },
  "device": {
    "model": "MPC5554"
  },
  "test": {
    "id": "PBIT-CAN-A-0021",
    "target": "CAN_A",
    "name": "CAN_A 总线通信自检",
    "result": "fail"
  },
  "observations": [
    {
      "id": "OBS-1",
      "kind": "register",
      "target": "CAN_A",
      "at": "2026-09-18T14:32:05.120+08:00",
      "capture_id": "CAP-ECR-1",
      "semantics": "instantaneous",
      "register": "CAN_A.ECR",
      "fields": {
        "TXECTR": 96,
        "RXECTR": 0
      }
    },
    {
      "id": "OBS-2",
      "kind": "register",
      "target": "CAN_A",
      "at": "2026-09-18T14:32:05.123+08:00",
      "capture_id": "CAP-ESR-1",
      "semantics": "since_last_read",
      "register": "CAN_A.ESR",
      "fields": {
        "BIT1ERR": 0,
        "BIT0ERR": 0,
        "ACKERR": 1,
        "CRCERR": 0,
        "FRMERR": 0,
        "STFERR": 1
      }
    },
    {
      "id": "OBS-3",
      "kind": "register",
      "target": "CAN_A",
      "at": "2026-09-18T14:32:05.123+08:00",
      "capture_id": "CAP-ESR-1",
      "semantics": "instantaneous",
      "register": "CAN_A.ESR",
      "fields": {
        "FLTCONF": "bus_off",
        "TXWRN": 1,
        "RXWRN": 0,
        "IDLE": 1,
        "TXRX": 0,
        "BOFFINT": 1
      }
    },
    {
      "id": "OBS-4",
      "kind": "register",
      "target": "CAN_A",
      "at": "2026-09-18T14:32:05.126+08:00",
      "capture_id": "CAP-CR-1",
      "semantics": "instantaneous",
      "register": "CAN_A.CR",
      "fields": {
        "LOM": 0,
        "BOFFMSK": 1,
        "BOFFREC": 1
      }
    },
    {
      "id": "OBS-5",
      "kind": "can_frame",
      "target": "CAN_A",
      "at": "2026-09-18T14:32:05.500+08:00",
      "direction": "tx",
      "identifier": "0x18F00400",
      "identifier_format": "extended",
      "dlc": 8,
      "acknowledged": false
    },
    {
      "id": "OBS-6",
      "kind": "can_frame",
      "target": "CAN_A",
      "at": "2026-09-18T14:32:05.640+08:00",
      "direction": "tx",
      "identifier": "0x18F00400",
      "identifier_format": "extended",
      "dlc": 8,
      "acknowledged": false
    },
    {
      "id": "OBS-7",
      "kind": "timeout",
      "target": "CAN_A",
      "at": "2026-09-18T14:32:05.700+08:00",
      "waiting_for": "CAN_A 报文发送完成",
      "limit_ms": 100,
      "elapsed_ms": 500
    }
  ],
  "analysis": {
    "fault_state": "confirmed",
    "root_cause": "candidates_only",
    "confirmed_states": [
      {
        "id": "CAN_A/FC-BUSOFF-BOFFREC-DISABLED",
        "statement": "CAN_A.CR 的 BOFFREC 位为 1 时禁用自动恢复，但该位对本次恢复的作用取决于进入总线关闭时的取值：进入总线关闭时该位已为 1 的，模块不会自动恢复，将保持该状态直至该位被清除；进入总线关闭时该位为 0、在总线关闭期间才置位的，对本次恢复无效，只在下一次进入总线关闭时生效。本结论只描述该配置位的作用与它生效的时点：不说明本次总线关闭是否已经发生，也不判断该配置是设计意图还是配置错误。",
        "evidence": [
          "OBS-4"
        ],
        "basis": {
          "source": "MPC5554_RM",
          "locator": "22.3.3.2, Table 22-8"
        }
      },
      {
        "id": "CAN_A/FC-BUSOFF-STATE",
        "statement": "采集时刻 CAN_A 处于总线关闭（bus off）状态。本结论只描述该时刻的故障封闭状态：不说明总线关闭发生的时刻，不说明进入总线关闭前的错误类型分布，也不判断异常位于本节点还是总线上的其他节点。",
        "evidence": [
          "OBS-3"
        ],
        "basis": {
          "source": "MPC5554_RM",
          "locator": "22.3.3.6, Figure 22-8, Table 22-11"
        }
      },
      {
        "id": "CAN_A/FC-BUSOFF-NO-ACK-ONLY",
        "statement": "进入总线关闭前的错误累积不可能仅来自无其他节点应答（ACK 错误）。本结论只排除「错误源仅为无应答」这一条路径：不排除总线上只有一个节点，单节点总线若同时存在位错误、填充错误等其他错误源，发送错误计数器仍可持续累积并进入总线关闭。",
        "evidence": [
          "OBS-3"
        ],
        "basis": {
          "source": "MPC5554_RM",
          "locator": "22.3.3.5"
        }
      }
    ],
    "candidate_causes": [
      {
        "id": "CC-1",
        "statement": "CAN 总线物理层异常，例如差分线短路或开路、终端电阻缺失或阻值失配",
        "supporting": [
          "OBS-2",
          "OBS-3"
        ],
        "contradicting": []
      },
      {
        "id": "CC-2",
        "statement": "CAN_A 与总线上其他节点的位定时配置不一致，例如波特率或采样点不匹配",
        "supporting": [
          "OBS-2",
          "OBS-3"
        ],
        "contradicting": []
      }
    ],
    "inconsistencies": [],
    "insufficient_data": [
      {
        "missing": "与 FLTCONF 处于同一时刻的 TXECTR 观测",
        "reason": "手册 22.3.3.5 规定进入总线关闭时 TXECTR 被复位为零并与另一个内部计数器级联，改为计数总线上「11 个连续隐性位」的出现次数，此时它已不是发送错误计数。要把 OBS-1 的取值用于任何判断，都需先确认该次采集时模块仍处于总线关闭；该观测与 FLTCONF 观测（OBS-3）来自不同的寄存器读取，契约中 capture_id 只表示同一次读取动作、不表示不同寄存器之间同步，因此这个前提未被观测，该 TXECTR 取值的语义是否已经改变无法判定。"
      },
      {
        "missing": "观测 OBS-2（CAN_A.ESR）覆盖区间的起点 covers_since",
        "reason": "手册 22.3.3.6 说明 BIT1ERR、BIT0ERR、ACKERR、CRCERR、FRMERR、STFERR 为读清除位且本次读取会将其清除；缺少覆盖区间的起点，就无法确定这些取值对应的时间范围，也无法判断它们是否与观测到的其他状态属于同一时期。"
      }
    ],
    "recommended_checks": [
      "按线束图确认终端配置后断电测量总线终端电阻；期望值须依据适用总线规范确认，本报告不给出未经核实的数值",
      "总线空闲时测量 CAN_H 与 CAN_L 差分电平",
      "读取 CAN_A.CR 的位定时字段 PRESDIV / PROPSEG / PSEG1 / PSEG2 / RJW 并与总线约定比对",
      "测量总线实际位时间",
      "在发送期间测量 CAN_TX 与 CAN_RX 引脚波形，并检查收发器供电与使能状态；该项为通用排查项，本案例无证据指向该方向",
      "补充采集时同时记录 ECR 与 ESR 的读取时刻，以确认 TXECTR 语义的适用区间",
      "补充采集时记录 ESR 的读取时刻，使错误标志的覆盖区间可知",
      "清除 BOFFINT 前先完整留存 ESR 快照，避免读清除位被后续读取覆盖"
    ],
    "unsupported": [
      {
        "subject": "CAN_A.ECR 的位域 RXECTR",
        "reason": "记录中已观测到 CAN_A.ECR 的 RXECTR（观测 OBS-1），但本版没有这些位域的判据，因此它们不参与判断。不支持表示本版没有依据，不等于这些取值未观测，也不等于取值正常。"
      },
      {
        "subject": "CAN_A.ESR 的位域 TXWRN、RXWRN、IDLE、TXRX、BOFFINT",
        "reason": "记录中已观测到 CAN_A.ESR 的 TXWRN、RXWRN、IDLE、TXRX、BOFFINT（观测 OBS-3），但本版没有这些位域的判据，因此它们不参与判断。不支持表示本版没有依据，不等于这些取值未观测，也不等于取值正常。"
      },
      {
        "subject": "CAN_A.CR 的位域 BOFFMSK",
        "reason": "记录中已观测到 CAN_A.CR 的 BOFFMSK（观测 OBS-4），但本版没有这些位域的判据，因此它们不参与判断。不支持表示本版没有依据，不等于这些取值未观测，也不等于取值正常。"
      },
      {
        "subject": "观测种类：can_frame、timeout",
        "reason": "本版没有使用这些观测的判据，因此它们不参与判断。这不表示这些观测所描述的情况不存在或正常。"
      }
    ]
  }
}
